{"$schema":"https://json-schema.org/draft/2020-12/schema","title":"Cost IQ Master Configuration","type":"object","required":["manifest","questions","dimensions","rules","findings","recommendations"],"properties":{"manifest":{"type":"object","required":["product","releaseId","schemaVersion"]},"questions":{"type":"array"},"dimensions":{"type":"array"},"rules":{"type":"array"},"findings":{"type":"array"},"recommendations":{"type":"array"}}}
