{
  "manifest": {"product":"Cost IQ","releaseId":"COSTIQ-0.1.0","releaseStatus":"draft","schemaVersion":"1.0","lastUpdated":"2026-09-14","author":"LTM Cost IQ Methodology"},
  "dimensions":[{"id":"DIM-COST-SPEND","name":"Spend Transparency","type":"cost","weight":1},{"id":"DIM-COST-CLOUD","name":"Cloud Economics","type":"cost","weight":1},{"id":"DIM-VALUE-BENEFITS","name":"Benefits Realization","type":"value","weight":1}],
  "questions":[{"id":"CORE-12","section":"Spend Visibility","prompt":"How clearly can you explain where your organization's total technology spend goes?","intent":"Establish whether the CIO has an enterprise-wide cost baseline rather than fragmented views.","interaction":"single-select","required":true,"options":[{"id":"A","label":"We have an enterprise-wide view — spend is consolidated across the major technology categories and ownership is clear."},{"id":"B","label":"We have a strong IT view — most spend is visible, but some business-led or indirect technology spend sits outside it."},{"id":"C","label":"Visibility is fragmented — major categories are known, but allocation and ownership are inconsistent."},{"id":"D","label":"We mainly see departmental or vendor-level spend and cannot reliably build an enterprise technology cost picture."},{"id":"E","label":"We do not have a reliable baseline — even total technology spend is difficult to establish."}],"scoring":{"signalId":"SIG-SPEND-001","dimensionId":"DIM-COST-SPEND","map":{"A":100,"B":80,"C":55,"D":30,"E":10}},"findingIds":["F-001"],"recommendationIds":["R-001"]},{"id":"CORE-24","section":"Cloud Economics","prompt":"How effectively does your organization optimize cloud consumption against actual business demand?","intent":"Determine whether cloud consumption is actively managed for waste, sizing and demand alignment.","interaction":"slider","required":true,"slider":{"min":0,"max":100,"step":5,"leftLabel":"Largely unmanaged","rightLabel":"Continuously optimized"},"scoring":{"signalId":"SIG-CLOUD-001","dimensionId":"DIM-COST-CLOUD","sliderInverse":false},"findingIds":["F-005"],"recommendationIds":["R-003"]},{"id":"CORE-44","section":"Technology Value","prompt":"For major technology investments, how consistently do you measure the business outcome you expected to achieve?","intent":"Assess whether technology investment decisions are connected to measurable business benefits.","interaction":"stars","required":true,"stars":{"min":1,"max":5,"labels":["Rarely","Inconsistently","Sometimes","Usually","Consistently"]},"scoring":{"signalId":"SIG-BENEFITS-001","dimensionId":"DIM-VALUE-BENEFITS","starScale":5},"findingIds":["F-004"],"recommendationIds":["R-009"]}],
  "rules":[{"id":"RULE-CLOUD-LEAK","type":"threshold","when":{"questionId":"CORE-24","operator":"<","value":50},"findingId":"F-005","priority":"high"},{"id":"RULE-BENEFITS-LEAK","type":"threshold","when":{"questionId":"CORE-44","operator":"<=","value":2},"findingId":"F-004","priority":"high"}],
  "findings":[{"id":"F-001","title":"Technology spend baseline is not sufficiently transparent","description":"The current cost view may not provide a reliable enterprise picture for challenge, allocation or investment decisions.","severity":"high","dimensionId":"DIM-COST-SPEND","recommendationIds":["R-001"]},{"id":"F-004","title":"Technology investment benefits are not consistently measured","description":"Benefits may be tracked unevenly, reducing the CIO's ability to distinguish investment that creates value from investment that simply consumes budget.","severity":"high","dimensionId":"DIM-VALUE-BENEFITS","recommendationIds":["R-009"]},{"id":"F-005","title":"Cloud consumption may contain avoidable leakage","description":"Cloud consumption appears insufficiently aligned to actual demand, creating potential optimization and cost-avoidance opportunity subject to evidence validation.","severity":"high","dimensionId":"DIM-COST-CLOUD","recommendationIds":["R-003"]}],
  "recommendations":[{"id":"R-001","title":"Establish an Enterprise Technology Spend Baseline","description":"Create a reconciled view of technology spend across major categories, ownership and material business-led spend.","findingIds":["F-001"],"ltmService":"Technology Spend & Cost Baseline"},{"id":"R-003","title":"Run a Cloud Economics Diagnostic","description":"Validate demand alignment, rightsizing, commitment strategy, tagging and consumption governance before sizing any savings opportunity.","findingIds":["F-005"],"ltmService":"FinOps & Cloud Cost Optimization"},{"id":"R-009","title":"Institutionalize Benefits Realization","description":"Set measurable benefit baselines, targets and post-implementation reviews for major technology investments.","findingIds":["F-004"],"ltmService":"Evidence-Led Cost & Value Assessment"}]
}
